{
  "schema": "edgp.impact.report.v1",
  "ecosystem": "npm",
  "root": "demo-app==1.0.0",
  "node": "left-pad==1.3.0",
  "metadata": {
    "ecosystem": "npm",
    "license": "WTFPL"
  },
  "summary": {
    "directDependents": 2,
    "affectedDependents": 2,
    "directDependencies": 0,
    "renderedChains": 2,
    "truncatedChains": 0
  },
  "directDependents": [
    "@scope/tool==2.1.0",
    "demo-app==1.0.0"
  ],
  "directDependencies": [],
  "affectedDependents": [
    {
      "package": "@scope/tool==2.1.0",
      "distance": 1
    },
    {
      "package": "demo-app==1.0.0",
      "distance": 1
    }
  ],
  "dependencyChainsToNode": [
    {
      "package": "@scope/tool==2.1.0",
      "distance": 1,
      "path": [
        "@scope/tool==2.1.0",
        "left-pad==1.3.0"
      ]
    },
    {
      "package": "demo-app==1.0.0",
      "distance": 1,
      "path": [
        "demo-app==1.0.0",
        "left-pad==1.3.0"
      ]
    }
  ]
}
